{
  "$schema": "../schema/scenario.schema.json",
  "name": "empty",
  "description": "Scenario vuoto: utente anonimo, nessun dato. Usato come fallback in caso di JSON corrotto.",
  "auth": {
    "currentUser": {
      "id": "MOCK-00000000-0000-0000-0000-000000000000",
      "email": "guest@meeple.local",
      "displayName": "Guest",
      "role": "Guest"
    },
    "availableUsers": []
  },
  "games": [],
  "sessions": [],
  "library": {
    "ownedGameIds": [],
    "wishlistGameIds": []
  },
  "chatHistory": [],
  "bggGames": [],
  "documents": []
}
